{
  "version": "v2.0.4",
  "owner": "uDOS-core",
  "schema": "schemas/mcp-tool-contract.schema.json",
  "summary": "Core-owned MCP tool contract for typed invocation, budgeting metadata, and policy-bound scheduling classes.",
  "required_fields": [
    "tool_id",
    "tool_owner",
    "transport",
    "tool_class",
    "network_required",
    "input_schema",
    "output_schema",
    "budget_group",
    "approval_required",
    "schedule_classes",
    "audit_required"
  ],
  "schedule_classes": [
    "immediate",
    "next_window",
    "nightly",
    "paced",
    "manual_only",
    "approval_required"
  ],
  "owners": {
    "contract": "uDOS-core",
    "managed_mcp_owner": "uDOS-wizard",
    "fixture_validation_owner": "uDOS-dev"
  }
}
